model,sentence,answer,condition,best_response,best_response_lp,entropy,is_joke
mistralai/Mixtral-8x7B-v0.1,"The new tax forms are more realistic-- where your wife signs, it says: partner.",Tax forms are very old-fashioned.,S,1,-0.83496094,1.0851286663520159,False
mistralai/Mixtral-8x7B-v0.1,The newspaper photo was so murky he couldn't figure out who it was until he read the caption.,He could see the person in the photo clearly.,E,1,-1.0019531,1.0867234815077937,False
mistralai/Mixtral-8x7B-v0.1,The nurse gave him detailed instructions about how to clean the wound and put on a fresh bandage.,He had been injured.,E,1,-0.9628906,1.1618179505690958,False
mistralai/Mixtral-8x7B-v0.1,The old wealthy family lived in a twelve bedroom mansion.,They lived in a small home.,E,1,-1.2304688,1.3046616903000787,False
mistralai/Mixtral-8x7B-v0.1,The only crop that is grown in America and harvested abroad is the American tobacco.,Very few foreigners smoke American cigarettes.,S,1,-1.0664062,1.205424532223551,False
mistralai/Mixtral-8x7B-v0.1,The only crop that is grown in America and harvested abroad is the American tourist.,Tourists spend a lot of money in other countries.,J,1,-1.15625,1.2418616849471444,True
mistralai/Mixtral-8x7B-v0.1,The only fishing through the ice that some men ever do is for the olive.,Some men fish; others just drink martinis.,J,1,-1.0488281,1.1773878085073601,True
mistralai/Mixtral-8x7B-v0.1,The only fishing through the ice that some men ever do is for the trout.,Some ice fishermen only want to catch trout.,S,1,-1.0693359,1.1435405819220095,False
mistralai/Mixtral-8x7B-v0.1,The only ones who want me for my body are losers.,Everybody finds me very attractive.,S,1,-1.0146484,1.1854471945562746,False
mistralai/Mixtral-8x7B-v0.1,The only ones who want me for my body are mosquitoes.,People find me very sexy.,J,1,-0.984375,1.1310669178362869,True
mistralai/Mixtral-8x7B-v0.1,The only person who sticks closer to you in adversity than a friend is a creditor.,People you owe money to don't hang around much.,J,1,-1.0751953,1.1490609710789976,True
mistralai/Mixtral-8x7B-v0.1,The only person who sticks closer to you in adversity than a friend is a spouse.,You just can't depend on a husband or wife.,S,1,-1.1542969,1.1848673977787942,False
mistralai/Mixtral-8x7B-v0.1,The only place where you can find people who spend all their time minding their own business is the bank.,People at banks are very nosy.,S,1,-1.0830078,1.199929195584241,False
mistralai/Mixtral-8x7B-v0.1,The only place where you can find people who spend all their time minding their own business is the cemetery.,Everybody is nosy to some extent.,J,1,-0.921875,1.042906568672836,True
mistralai/Mixtral-8x7B-v0.1,The only thing money can't buy is generosity.,Just because you have money doesn't mean you'll share it.,S,1,-1.0322266,1.156326499017189,False
mistralai/Mixtral-8x7B-v0.1,The only thing money can't buy is poverty.,Money can buy almost anything.,J,1,-0.90722656,1.0818788584667967,True
mistralai/Mixtral-8x7B-v0.1,The only time my father ever raised a hand to his children was in discipline.,My father didn't believe in corporal punishment.,S,1,-0.79541016,0.9665404996951815,False
mistralai/Mixtral-8x7B-v0.1,The only time my father ever raised a hand to his children was in self-defense.,My father beat his children a lot.,J,1,-0.9042969,1.0774345423377762,True
mistralai/Mixtral-8x7B-v0.1,The paint turned out to be the wrong color.,They were putting up wallpaper.,E,1,-1.0146484,1.1829258842625914,False
mistralai/Mixtral-8x7B-v0.1,The painter used water-based paint for the interior of the house but enamel for the exterior.,He used the same paint both inside and outside the house.,E,1,-1.1474609,1.2310284835511354,False
mistralai/Mixtral-8x7B-v0.1,The penalty for dishonesty is the disgrace of dying rich.,Liars never win.,J,1,-0.890625,1.0472877418179105,True
mistralai/Mixtral-8x7B-v0.1,The penalty for dishonesty is the disgrace of dying unloved.,People who lie don't have many friends.,S,1,-1.0615234,1.2160459726044648,False
mistralai/Mixtral-8x7B-v0.1,The perfect companion to a vegetarian dinner is a salad.,A vegetarian meal doesn't need a salad.,S,1,-1.1445312,1.316191529877996,False
mistralai/Mixtral-8x7B-v0.1,The perfect companion to a vegetarian dinner is a steak.,I don't believe in eating meat.,J,1,-1.0117188,1.2185889573460331,True
mistralai/Mixtral-8x7B-v0.1,The policeman saw him throw the bottle out the window and gave him a ticket for littering.,He got a ticket for speeding.,E,1,-1.1201172,1.2631330364095503,False
mistralai/Mixtral-8x7B-v0.1,The Republican candidate won the election by a landslide.,The election was very close.,E,1,-0.89160156,1.1268496256487546,False
mistralai/Mixtral-8x7B-v0.1,The rodeo champion was quite proud of his big silver belt buckle.,The rodeo champion didn't wear a belt.,E,1,-1.0800781,1.1997928008661727,False
mistralai/Mixtral-8x7B-v0.1,The show had one act that was really offbeat: the clowns.,The clowns were really out of the ordinary.,S,1,-0.9692383,1.142533218629365,False
mistralai/Mixtral-8x7B-v0.1,The show had one act that was really offbeat: the singer.,The singer had poor rhythm.,J,1,-0.9584961,1.1959692159390218,True
mistralai/Mixtral-8x7B-v0.1,The surgeon tried vainly to save his patient.,The patient died.,E,1,-1.1757812,1.2584822805217237,False
mistralai/Mixtral-8x7B-v0.1,The teacher wrote the problem on the board.,The teacher was going to explain the problem.,E,1,-1.9931641,1.1736653852266001,False
mistralai/Mixtral-8x7B-v0.1,The terrorists planted a bomb in the airport and four people were killed in the explosion.,The bomb squad was able to defuse the bomb.,E,1,-1.0273438,1.221095744712817,False
mistralai/Mixtral-8x7B-v0.1,The tourist bureau told the visitors there was plenty of hunting in this part of the country but very little finding.,Things are hard to find in this area.,J,1,-1.0195312,1.118919738223782,True
mistralai/Mixtral-8x7B-v0.1,The tourist bureau told the visitors there was plenty of hunting in this part of the country but very little sightseeing.,There aren't many tourist sights in the area.,S,1,-0.9355469,1.124277808040225,False
mistralai/Mixtral-8x7B-v0.1,The victim was rushed to the hospital in an ambulance.,The victim wasn't hurt in the accident.,E,1,-1.1103516,1.2773136578331705,False
mistralai/Mixtral-8x7B-v0.1,The visitor stared at the grandfather clock and seemed almost hypnotized by the swinging of the pendulum.,The visitor could see the clock.,E,1,-0.9946289,1.1287514776254974,False
mistralai/Mixtral-8x7B-v0.1,The whole town came to hear their mayor speak.,The people wanted to hear what the mayor would say.,E,1,-1.1982422,1.274785041253095,False
mistralai/Mixtral-8x7B-v0.1,The wind was so strong it blew out three fuses.,The wind affected the electrical system.,J,1,-1.1171875,1.230107039095538,True
mistralai/Mixtral-8x7B-v0.1,The wind was so strong it blew out three streetlights.,The storm didn't cause any damage.,S,1,-1.1552734,1.2463913610133508,False
mistralai/Mixtral-8x7B-v0.1,The woman in the grocery store was handing out free samples.,The samples cost ten cents each.,E,1,-1.1416016,1.2595908282578638,False
mistralai/Mixtral-8x7B-v0.1,The woman who has her husband eating out of her hand must save a lot of dishwashing.,The husband washes all the dishes.,J,1,-1.0976562,1.2193462251436837,True
mistralai/Mixtral-8x7B-v0.1,The woman who has her husband eating out of her hand must save a lot of heartbreak.,She's happy because her husband does what she wants.,S,1,-1.1601562,1.2757288796982698,False
mistralai/Mixtral-8x7B-v0.1,There were over a hundred trees in the apple orchard.,It was an extremely small orchard.,E,1,-1.2265625,1.275719380049807,False
mistralai/Mixtral-8x7B-v0.1,They planned to dig a tunnel in order to escape.,They were being held prisoner.,E,1,-1.1025391,1.2687537620813085,False
mistralai/Mixtral-8x7B-v0.1,They redecorated the bar with new drunks.,The bar has all new furniture.,J,1,-0.97753906,1.1519334193580075,True
mistralai/Mixtral-8x7B-v0.1,They redecorated the bar with new wood.,The bar is all chrome and glass.,S,1,-1.0439453,1.2271914248353926,False
mistralai/Mixtral-8x7B-v0.1,They went to Las Vegas and got married in one of those quickie wedding chapels.,They spent months planning a big wedding.,E,1,-1.03125,1.2140502709041214,False
mistralai/Mixtral-8x7B-v0.1,This fall two things are turning yellow: trees and bushes.,The leaves are changing color.,S,1,-1.0654297,1.1632566860447333,False
mistralai/Mixtral-8x7B-v0.1,This fall two things are turning yellow: trees and investors.,Investors are becoming scared.,J,1,-1.2509766,1.2407734635340073,True
mistralai/Mixtral-8x7B-v0.1,"This house comes with a lot of extras, mostly termites.",The house is free of bugs.,J,1,-0.96533203,1.131083372447539,True
mistralai/Mixtral-8x7B-v0.1,"This house comes with a lot of extras, mostly upgrades.",The house would be a good purchase.,S,1,-1.1708984,1.2926407137018014,False
mistralai/Mixtral-8x7B-v0.1,"This new computer works so quickly, it comes complete with games.","If you use this computer, you'll have time left to play.",S,1,-1.2333984,1.2629132865499773,False
mistralai/Mixtral-8x7B-v0.1,"This new computer works so quickly, it comes complete with ulcers.",The computer feels no stress.,J,1,-0.8925781,1.04469655381171,True
mistralai/Mixtral-8x7B-v0.1,"Though most people think it's Rome, the world's most beloved capital is actually dollars.",People love money.,J,1,-1.1357422,1.2593960600382783,True
mistralai/Mixtral-8x7B-v0.1,"Though most people think it's Rome, the world's most beloved capital is actually Vienna.",Rome is more beloved than Vienna.,S,1,-1.1035156,1.2553576840447949,False
mistralai/Mixtral-8x7B-v0.1,Three people were killed in a major highway accident.,The accident had not been fatal.,E,1,-0.9243164,1.1647423301675264,False
mistralai/Mixtral-8x7B-v0.1,Tim threw a rock and broke the window.,Tim was playing baseball.,E,1,-1.1230469,1.2727993868255376,False
mistralai/Mixtral-8x7B-v0.1,"To clothe one soldier, it takes the wool from two sheep and the hides from three animals.",Military uniforms are made from natural materials.,S,1,-1.1933594,1.2269091527206308,False
mistralai/Mixtral-8x7B-v0.1,"To clothe one soldier, it takes the wool from two sheep and the hides from three taxpayers.",Military uniforms are expensive.,J,1,-1.0859375,1.175781872249919,True
mistralai/Mixtral-8x7B-v0.1,"To get something done, a committee should consist of no more than three people, two of whom are dead.",Groups are more efficient than individuals.,J,1,-0.8959961,0.9244204579935811,True
mistralai/Mixtral-8x7B-v0.1,"To get something done, a committee should consist of no more than three people, two of whom are workers.",A committee works best with one leader.,S,1,-1.0966797,1.1408130174178008,False
mistralai/Mixtral-8x7B-v0.1,To keep the dogs out of the yard he put up a fence.,He was worried his pet would escape.,E,1,-1.1962891,1.2949226413308952,False
mistralai/Mixtral-8x7B-v0.1,To pay for the car Al simply wrote a check.,Al paid with a credit card.,E,1,-1.0410156,1.25807247805529,False
mistralai/Mixtral-8x7B-v0.1,Too many girls believe that the chief foundation for true love is a large fortune.,A lot of women marry for money.,S,1,-0.9501953,1.1586045540172067,False
mistralai/Mixtral-8x7B-v0.1,Too many girls believe that the chief foundation for true love is a large stone.,Some girls just want a big diamond ring.,J,1,-1.0292969,1.2017774189875767,True
mistralai/Mixtral-8x7B-v0.1,Two things are essential for success: wealth and fame.,Having money without celebrity is still success.,S,1,-0.9995117,1.2132343975341415,False
mistralai/Mixtral-8x7B-v0.1,Two things are essential for success: wealth and money.,You don't need much cash to succeed in business.,J,1,-0.9140625,1.121016552765294,True
mistralai/Mixtral-8x7B-v0.1,We finally got a decent picture on the TV after an hour of adjusting the antenna.,The TV had poor reception.,E,1,-0.83496094,1.0661750171948186,False
mistralai/Mixtral-8x7B-v0.1,We live in a lovely suburb; it's just two miles beyond our income.,We can't afford to live where we do.,J,1,-1.2783203,1.2529016741503525,True
mistralai/Mixtral-8x7B-v0.1,We live in a lovely suburb; it's just two miles beyond our town.,The suburb is far from the city.,S,1,-1.2011719,1.2576842993240696,False
mistralai/Mixtral-8x7B-v0.1,"We used to have food on the table as soon as the customer was seated, but our new system requires more effort.",We have to work harder now.,S,1,-1.0322266,1.1829577774816937,False
mistralai/Mixtral-8x7B-v0.1,"We used to have food on the table as soon as the customer was seated, but our new system requires more plates.",Our service is faster now.,J,1,-1.1123047,1.2389935858859198,True
mistralai/Mixtral-8x7B-v0.1,"When an irresistible force meets an immovable object, you get two very angry entities.","When one thing runs into another, both become unhappy.",S,1,-1.2890625,1.2961725148019032,False
mistralai/Mixtral-8x7B-v0.1,"When an irresistible force meets an immovable object, you get two very angry women.",Women can be stubborn.,J,1,-1.2314453,1.2599703304821015,True
mistralai/Mixtral-8x7B-v0.1,"When he stepped into the elevator, he knew Jennifer had just been there by the smell of her perfume.",Jennifer wore strong perfume.,E,1,-1.1826172,1.2320609504173634,False
mistralai/Mixtral-8x7B-v0.1,"When I asked how long I should cook the noodles, he said at least ten inches.",The noodles should be at least ten inches long.,J,1,-0.7246094,0.9328868034834464,True
mistralai/Mixtral-8x7B-v0.1,"When I asked how long I should cook the noodles, he said at least ten seconds.",They had already eaten.,S,1,-0.8647461,0.9933000917911762,False
mistralai/Mixtral-8x7B-v0.1,"When I asked the bartender for something cold and full of rum, he recommended his daiquiri.",The bartender recommended a drink.,S,1,-1.0253906,1.2362645575352489,False
mistralai/Mixtral-8x7B-v0.1,"When I asked the bartender for something cold and full of rum, he recommended his wife.",The bartender was married.,J,1,-0.87353516,1.046994382101812,True
mistralai/Mixtral-8x7B-v0.1,"When I found out how much my wife spent on dresses last year, I dumped her and proposed to the dressmaker.",The dressmaker had a lot of my money.,J,1,-0.95654297,1.1565733822133917,True
mistralai/Mixtral-8x7B-v0.1,"When I found out how much my wife spent on dresses last year, I dumped her and proposed to the mistress.",I had been faithful to my wife.,S,1,-0.9223633,1.178552016198065,False
mistralai/Mixtral-8x7B-v0.1,"When it comes to keeping warm, nothing beats a thermal brunette.",A down parka is the best way to keep warm.,J,1,-1.0898438,1.1975840187093503,True
mistralai/Mixtral-8x7B-v0.1,"When it comes to keeping warm, nothing beats a thermal parka.",A trenchcoat is the best way to keep warm.,S,1,-1.0976562,1.236188263579915,False
mistralai/Mixtral-8x7B-v0.1,"When John bought a bulldog, it was no time at all before he had that dog eating out of his fingers.",He trained the dog well.,S,1,-1.1445312,1.251395743322728,False
mistralai/Mixtral-8x7B-v0.1,"When John bought a bulldog, it was no time at all before he had that dog eating out of his leg.",The dog was aggressive.,J,1,-1.1220703,1.2528777730149117,True
mistralai/Mixtral-8x7B-v0.1,"When reviewing your notes for a test, the most important ones will be capitalized.",Pay more attention to the things in small print.,S,1,-1.0644531,1.2240032900640667,False
mistralai/Mixtral-8x7B-v0.1,"When reviewing your notes for a test, the most important ones will be illegible.",Important notes are written clearly so they stand out.,J,1,-1.4882812,1.3599605104902053,True
mistralai/Mixtral-8x7B-v0.1,"When the kid came into the store and asked for empty boxes, the owner gave him the crate.",The kid didn't get any boxes.,S,1,-1.0576172,1.1816320631837034,False
mistralai/Mixtral-8x7B-v0.1,"When the kid came into the store and asked for empty boxes, the owner gave him the register.",The store had made a lot of money.,J,1,-1.1230469,1.238561784636515,True
mistralai/Mixtral-8x7B-v0.1,When they were in London they visited Buckingham Palace.,They made a trip to England.,E,1,-1.0908203,1.3088295647157868,False
mistralai/Mixtral-8x7B-v0.1,"When we got divorced, my wife and I split the house; she got the inside.",I got the outside.,J,1,-1.1210938,1.1907074046299146,True
mistralai/Mixtral-8x7B-v0.1,"When we got divorced, my wife and I split the house; she got the kitchen.",My wife gave me the kitchen items.,S,1,-1.1162109,1.2037318848453713,False
mistralai/Mixtral-8x7B-v0.1,"When we watch a sexy movie, my wife leans over and breathes on my collar.",She wants to get me excited.,S,1,-1.1386719,1.2579676009388152,False
mistralai/Mixtral-8x7B-v0.1,"When we watch a sexy movie, my wife leans over and breathes on my glasses.",She wants me to see the movie.,J,1,-1.0585938,1.1877531064954665,True
mistralai/Mixtral-8x7B-v0.1,"When you go to bed, turn off the lights.",The lights are on.,E,1,-1.1425781,1.2518589987223059,False
mistralai/Mixtral-8x7B-v0.1,"When you own an ice cream business, your favorite flavor is aspirin.",Running an ice cream business can give you a headache.,J,1,-1.0029297,1.1719935724289687,True
mistralai/Mixtral-8x7B-v0.1,"When you own an ice cream business, your favorite flavor is everything.",You start to like all the flavors.,S,1,-1.1552734,1.259896579625467,False
mistralai/Mixtral-8x7B-v0.1,"Where I'm from, the two most common elements are hydrogen and nitrogen.",Phosphorus is the most common element in my hometown.,S,1,-0.9716797,1.0508964323919996,False
mistralai/Mixtral-8x7B-v0.1,"Where I'm from, the two most common elements are hydrogen and stupidity.",People in my hometown are very smart.,J,1,-1.1210938,1.1719748634495477,True
mistralai/Mixtral-8x7B-v0.1,"Women don't dress to please men; if they did, they'd dress a lot faster.",Women take a long time to get dressed.,J,1,-1.1513672,1.205303549682776,True
mistralai/Mixtral-8x7B-v0.1,"Women don't dress to please men; if they did, they'd dress a lot scantier.",Men prefer women who wear a lot of clothes.,S,1,-1.1806641,1.2351468938286982,False
mistralai/Mixtral-8x7B-v0.1,Women were not allowed to vote until when Congress passed the nineteenth amendment to the constitution.,Women in 1900 could not vote.,E,1,-0.66845703,1.0656154206171853,False
mistralai/Mixtral-8x7B-v0.1,Yesterday they canoed down the river.,They spent yesterday outdoors.,E,1,-1.2080078,1.2874735923976963,False
mistralai/Mixtral-8x7B-v0.1,You can keep your kids out of hot water with dishes.,Kids like to wash dishes.,J,1,-1.0166016,1.1956166855361603,True
mistralai/Mixtral-8x7B-v0.1,You can keep your kids out of hot water with rules.,Clear boundaries help keep kids out of trouble.,S,1,-1.0429688,0.9615802161966436,False
mistralai/Mixtral-8x7B-v0.1,You could tell he had grown up in the South by his accent.,He talked like a Southerner.,E,1,-0.7832031,1.008759107737794,False
