model,sentence,answer,condition,best_response,best_response_lp,entropy,is_joke
mistralai/Mixtral-8x7B-v0.1,It's not hard to meet expenses; they're affordable.,You should be able to pay all your bills.,S,1,-1.0722656,1.2104559392429455,False
mistralai/Mixtral-8x7B-v0.1,It's not hard to meet expenses; they're everywhere.,It's easy to pay the bills.,J,1,-0.8017578,0.9603356416482847,True
mistralai/Mixtral-8x7B-v0.1,Last Thanksgiving my wife spent all morning in the kitchen stuffing the bird.,She was preparing the turkey.,S,1,-1.0019531,1.1960090020682805,False
mistralai/Mixtral-8x7B-v0.1,Last Thanksgiving my wife spent all morning in the kitchen stuffing the kids.,The kids didn't get enough to eat.,J,1,-1.0478516,1.1352444925286982,True
mistralai/Mixtral-8x7B-v0.1,"Love has its benefits, and they are usually called alimony.",Divorce can get you some money.,J,1,-0.96435547,1.0412974443837195,True
mistralai/Mixtral-8x7B-v0.1,"Love has its benefits, and they are usually called memories.",Being in love leads to good times together.,S,1,-1.2080078,1.246841101105529,False
mistralai/Mixtral-8x7B-v0.1,Many a freshman helps the college of his choice by becoming a dropout.,"When a freshman fails, it always hurts the college.",J,1,-1.1416016,1.221065527896968,True
mistralai/Mixtral-8x7B-v0.1,Many a freshman helps the college of his choice by becoming a member.,Joining a college doesn't make any difference.,S,1,-1.0224609,1.1258709833593599,False
mistralai/Mixtral-8x7B-v0.1,Many a man's idea of a vacation is to rest quietly in the shade of a blonde.,Men like to vacation alone.,J,1,-1.0292969,1.135222777347318,True
mistralai/Mixtral-8x7B-v0.1,Many a man's idea of a vacation is to rest quietly in the shade of a palm.,Many men like a relaxing vacation in the tropics.,S,1,-1.15625,1.2499380358028935,False
mistralai/Mixtral-8x7B-v0.1,"Many things run in families, especially noses.",People often catch colds from other family members.,J,1,-1.0097656,1.1592337120244438,True
mistralai/Mixtral-8x7B-v0.1,"Many things run in families, especially strength.",Muscle power comes only from exercise.,S,1,-0.9433594,1.1303035593497093,False
mistralai/Mixtral-8x7B-v0.1,Modern science is amazing: garbage is now being made into gasoline.,Fuel can be made from trash.,S,1,-0.9941406,1.255349731311302,False
mistralai/Mixtral-8x7B-v0.1,Modern science is amazing: garbage is now being made into movies.,There are a lot of really terrible movies nowadays.,J,1,-1.0068359,1.2281574336461247,True
mistralai/Mixtral-8x7B-v0.1,Most cats see very well at night.,Cats see well in the dark.,E,1,-1.1435547,1.303225939050891,False
mistralai/Mixtral-8x7B-v0.1,Most of the people running for office are not politicians; they're candidates.,You become a politician when you get elected.,S,1,-0.8881836,1.0038942957372288,False
mistralai/Mixtral-8x7B-v0.1,Most of the people running for office are not politicians; they're commuters.,These people are hurrying to get to work on time.,J,1,-1.0224609,1.128831230402477,True
mistralai/Mixtral-8x7B-v0.1,Mrs Martin told the bad student to stand in the corner.,Mrs Martin was unhappy with the student's behavior.,E,1,-1.1367188,1.2424401716408264,False
mistralai/Mixtral-8x7B-v0.1,My brother-in-law enjoys fixing things around the house so much he spent an hour last night just fixing our drinks.,My brother-in-law fixed our plumbing.,J,1,-1.2177734,1.2981667579897198,True
mistralai/Mixtral-8x7B-v0.1,My brother-in-law enjoys fixing things around the house so much he spent an hour last night just fixing our stove.,He's a real handyman.,S,1,-1.2646484,1.3277014950160408,False
mistralai/Mixtral-8x7B-v0.1,My church welcomes all denominations but prefers Mormons.,My church is strictly Catholic.,S,1,-1.1308594,1.2429211673302372,False
mistralai/Mixtral-8x7B-v0.1,My church welcomes all denominations but prefers twenties.,My church wants money.,J,1,-1.2275391,1.2916165373824606,True
mistralai/Mixtral-8x7B-v0.1,My doctor has never violated his oath: the oath he took years ago to become a millionaire.,My doctor charges a lot of money.,J,1,-1.1767578,1.268704026884722,True
mistralai/Mixtral-8x7B-v0.1,My doctor has never violated his oath: the oath he took years ago to become a practitioner.,My doctor is very honorable.,S,1,-1.0791016,1.2375153405022439,False
mistralai/Mixtral-8x7B-v0.1,My husband took the money we were saving to buy a new car and blew it all at the laundry.,We had saved a lot of money.,J,1,-1.0761719,1.192617939525534,True
mistralai/Mixtral-8x7B-v0.1,My husband took the money we were saving to buy a new car and blew it all at the tables.,He gambled away our savings.,S,1,-1.0996094,1.2195149125301328,False
mistralai/Mixtral-8x7B-v0.1,"My mechanic couldn't fix my brakes, so he fixed my clutch.",My clutch was also broken.,S,1,-1.40625,1.3819466431038663,False
mistralai/Mixtral-8x7B-v0.1,"My mechanic couldn't fix my brakes, so he fixed my horn.","He figures if I can't stop, I'll have to honk at people.",J,1,-1.296875,1.3490439460061918,True
mistralai/Mixtral-8x7B-v0.1,My wife did natural childbirth: no anesthetic.,She took drugs for the pain.,S,1,-1.21875,1.3474512388543616,False
mistralai/Mixtral-8x7B-v0.1,My wife did natural childbirth: no makeup.,My wife didn't wear makeup when she had her baby.,J,1,-1.25,1.3265455795261727,True
mistralai/Mixtral-8x7B-v0.1,"Nature has three ways of thinning the herd: drought, famine, and hunting.",Predatory hunting reduces the number of prey.,S,1,-1.0517578,1.1847797377674392,False
mistralai/Mixtral-8x7B-v0.1,"Nature has three ways of thinning the herd: drought, famine, and primaries.",Politics is a lot like nature.,J,1,-1.0302734,1.1263503583874852,True
mistralai/Mixtral-8x7B-v0.1,No patient should leave the hospital until he's strong enough to face the cashier.,Hospital bills are quite expensive.,J,1,-0.9873047,1.1329647183675489,True
mistralai/Mixtral-8x7B-v0.1,No patient should leave the hospital until he's strong enough to face the outside.,Patients should be released as soon as possible.,S,1,-0.9663086,1.1358077485019034,False
mistralai/Mixtral-8x7B-v0.1,None of his books made any sense.,His books were hard to understand.,E,1,-1.0078125,1.2350825207041054,False
mistralai/Mixtral-8x7B-v0.1,Nothing ages a woman faster than hardships.,A difficult life can make you look old.,S,1,-0.94433594,1.1545852732047215,False
mistralai/Mixtral-8x7B-v0.1,Nothing ages a woman faster than identification.,Many women lie about their age.,J,1,-1.1494141,1.2139427416831376,True
mistralai/Mixtral-8x7B-v0.1,Nothing in the known universe travels faster than gossip.,Rumors get around quickly.,J,1,-1.1191406,1.170124826882369,True
mistralai/Mixtral-8x7B-v0.1,Nothing in the known universe travels faster than radiation.,Radiation travels at great speed.,S,1,-1.1367188,1.206895023669383,False
mistralai/Mixtral-8x7B-v0.1,Nothing you put in a banana split is as potentially fattening as the spoon.,Eating banana splits can make you fat.,J,1,-1.1757812,1.1430538757320066,True
mistralai/Mixtral-8x7B-v0.1,Nothing you put in a banana split is as potentially fattening as the syrup.,Syrup has very few calories.,S,1,-1.2802734,1.195702015828263,False
mistralai/Mixtral-8x7B-v0.1,"Now that the Hollywood couple has ironed out the divorce settlement, they can finally go ahead with their careers.",The divorce hadn't affected their work.,S,1,-1.1582031,1.3328579846431095,False
mistralai/Mixtral-8x7B-v0.1,"Now that the Hollywood couple has ironed out the divorce settlement, they can finally go ahead with their nuptials.",They are already married.,J,1,-1.0986328,1.3079850266013202,True
mistralai/Mixtral-8x7B-v0.1,"Once a week they hold a bingo game, and all the proceeds go to fight disease.",They are raising money to build a new church.,S,1,-1.0263672,1.1663666391353635,False
mistralai/Mixtral-8x7B-v0.1,"Once a week they hold a bingo game, and all the proceeds go to fight gambling.",They are raising money to help orphans.,J,1,-1.0410156,1.1876204774690164,True
mistralai/Mixtral-8x7B-v0.1,One good turn gets most of the blanket.,"If you do nice things, people will give you blankets.",J,1,-0.9628906,1.1410296226382082,True
mistralai/Mixtral-8x7B-v0.1,One good turn gets most of the profit.,Doing something good can earn you money.,S,1,-0.96533203,1.0872553462427765,False
mistralai/Mixtral-8x7B-v0.1,One good way to invest in the country is to buy a business.,Buying a business is bad for the economy.,S,1,-1.0908203,1.1689730853768228,False
mistralai/Mixtral-8x7B-v0.1,One good way to invest in the country is to buy a senator.,Politicians will do favors for money.,J,1,-0.8613281,1.029123995012068,True
mistralai/Mixtral-8x7B-v0.1,One person who sure makes a long story short is my aunt.,My aunt talks a lot.,S,1,-0.9902344,1.107316294802334,False
mistralai/Mixtral-8x7B-v0.1,One person who sure makes a long story short is my editor.,My editor cuts out parts of my stories.,J,1,-1.1777344,1.3303795594969279,True
mistralai/Mixtral-8x7B-v0.1,One thing that makes the world go round is detours.,Detours make people go around.,J,1,-1.2080078,1.2661695528997026,True
mistralai/Mixtral-8x7B-v0.1,One thing that makes the world go round is greed.,Most people don't care about money.,S,1,-1.2109375,1.2361057541884186,False
mistralai/Mixtral-8x7B-v0.1,One way to keep pornography away from teenagers is to put it in a cabinet.,Adult magazines should be put where adolescents won't get into them.,S,1,-0.8774414,1.081940602410021,False
mistralai/Mixtral-8x7B-v0.1,One way to keep pornography away from teenagers is to put it in a textbook.,Teenagers read their textbooks often.,J,1,-0.9008789,1.0821556579148868,True
mistralai/Mixtral-8x7B-v0.1,Our new green car blocked the narrow driveway.,The car was parked in the garage.,E,1,-1.0742188,1.224488466951433,False
mistralai/Mixtral-8x7B-v0.1,Our son brought home a note from school saying they need a written excuse for his presence.,The son does very well in school.,J,1,-1.0205078,1.1397186508697916,True
mistralai/Mixtral-8x7B-v0.1,Our son brought home a note from school saying they need a written excuse for his tardiness.,He had been late for school.,S,1,-1.0585938,1.1080266946654749,False
mistralai/Mixtral-8x7B-v0.1,"Parents support clubs for teenagers, especially when they lack other forms of diversion.",Parents want their teenagers to have appropriate forms of entertainment.,S,1,-0.9165039,1.0907299725685953,False
mistralai/Mixtral-8x7B-v0.1,"Parents support clubs for teenagers, especially when they lack other forms of punishment.",Teenagers may need physical punishment.,J,1,-0.93408203,1.0898492633780859,True
mistralai/Mixtral-8x7B-v0.1,Paul heard a loud grinding noise when someone put a tin can right down the garbage disposal.,Paul broke the garbage disposal.,E,1,-1.1943359,1.264348127119276,False
mistralai/Mixtral-8x7B-v0.1,Politicians who are as American as apple pie still want their rewards.,Patriotic politicians don't care about personal glory.,S,1,-1.0537109,1.1293795151598878,False
mistralai/Mixtral-8x7B-v0.1,Politicians who are as American as apple pie still want their slice.,Politicians are happy to do something for nothing.,J,1,-1.0488281,1.163926192977692,True
mistralai/Mixtral-8x7B-v0.1,Save the whales; start a coalition.,"To save an endangered species, it's best to act alone.",S,1,-0.9458008,1.145579038782333,False
mistralai/Mixtral-8x7B-v0.1,Save the whales; start a collection.,It's important to protect endangered species in the wild.,J,1,-0.96484375,1.0188931309397655,True
mistralai/Mixtral-8x7B-v0.1,She always told girls not to look for a husband but just to date bachelors.,It's better to date a married man.,J,1,-1.1132812,1.2570727583000785,True
mistralai/Mixtral-8x7B-v0.1,She always told girls not to look for a husband but just to date someone.,She thinks you should wait for the perfect man.,S,1,-1.0751953,1.2529737272979349,False
mistralai/Mixtral-8x7B-v0.1,"She asked what state he was born in, and he said in the East.",He was a native Californian.,S,1,-0.84375,0.9974563587916038,False
mistralai/Mixtral-8x7B-v0.1,"She asked what state he was born in, and he said in the nude.",He said he was born in the North.,J,1,-0.80810547,1.1017015993157329,True
mistralai/Mixtral-8x7B-v0.1,She bought her father a tasteful tie for his birthday.,She was giving her father a Christmas gift.,E,1,-1.1015625,1.2924493516496756,False
mistralai/Mixtral-8x7B-v0.1,She called her husband at his office.,Her husband worked at home.,E,1,-1.09375,1.2612274552558667,False
mistralai/Mixtral-8x7B-v0.1,"She is so modest, she pulls down the shade to change her jacket.",She doesn't want people to see her change clothes.,S,1,-1.0273438,1.1568572186244879,False
mistralai/Mixtral-8x7B-v0.1,"She is so modest, she pulls down the shade to change her mind.",She likes to show off in front of others.,J,1,-0.9746094,1.1291511977022612,True
mistralai/Mixtral-8x7B-v0.1,She puts something behind her ears to attract men; lately she's been using her ankles.,She's very prudish.,J,1,-1.0332031,1.1936818157144633,True
mistralai/Mixtral-8x7B-v0.1,She puts something behind her ears to attract men; lately she's been using her vanilla.,She wears vanilla as a perfume.,S,1,-1.0449219,1.1807568049081107,False
mistralai/Mixtral-8x7B-v0.1,She read so much about the bad effects of cigarettes she decided to give up the habit.,She was going to quit smoking.,S,1,-1.2216797,1.3055355532897561,False
mistralai/Mixtral-8x7B-v0.1,She read so much about the bad effects of cigarettes she decided to give up the reading.,She planned to quit smoking.,J,1,-1.1601562,1.236134889180382,True
mistralai/Mixtral-8x7B-v0.1,She tied up her hair with a yellow ribbon.,She had very short hair.,E,1,-1.1064453,1.2149661453059108,False
mistralai/Mixtral-8x7B-v0.1,"She told him he looked like a million, and she meant every century.",She thought he looked quite young and handsome.,J,1,-0.94433594,1.130558292034121,True
mistralai/Mixtral-8x7B-v0.1,"She told him he looked like a million, and she meant every syllable.",She thought he looked good.,S,1,-1.0175781,1.2046573466632373,False
mistralai/Mixtral-8x7B-v0.1,She used a needle and a tweezers to pull out the splinter.,She needed a scalpel to remove the splinter.,E,1,-1.0839844,1.2445386505994729,False
mistralai/Mixtral-8x7B-v0.1,She was suddenly called back to New York and had to take a cab to the airport.,She was going to take a train.,E,1,-1.1152344,1.2485011864901654,False
mistralai/Mixtral-8x7B-v0.1,"She went on a fourteen day diet, but she only lost two ounces.",She didn't lose much weight.,S,1,-1.1611328,1.22755367072628,False
mistralai/Mixtral-8x7B-v0.1,"She went on a fourteen day diet, but she only lost two weeks.",She didn't lose any weight.,J,1,-1.0917969,1.182178353080084,True
mistralai/Mixtral-8x7B-v0.1,She's happy because she finally has a boyfriend who gets along with her father.,Her father really liked her previous boyfriends.,S,1,-1.0253906,1.2647499022430528,False
mistralai/Mixtral-8x7B-v0.1,She's happy because she finally has a boyfriend who gets along with her fiance.,She is dating more than one man.,J,1,-1.1210938,1.2838471131714715,True
mistralai/Mixtral-8x7B-v0.1,"Some babies are born to rule, while others are male.",Males are born rulers.,J,1,-1.0761719,1.1867846057660072,True
mistralai/Mixtral-8x7B-v0.1,"Some babies are born to rule, while others are weak.",Power starts at an early age.,S,1,-0.97216797,1.1469275938687424,False
mistralai/Mixtral-8x7B-v0.1,"Some husbands are good providers, but only if you count children.",Some men don't take care of their families.,J,1,-1.1064453,1.2144978547932874,True
mistralai/Mixtral-8x7B-v0.1,"Some husbands are good providers, but only if you count salary.",Some men give their families nothing but money.,S,1,-1.3144531,1.260590946461188,False
mistralai/Mixtral-8x7B-v0.1,Some people think courtship is the first in a series of steps leading to divorce.,One of those steps is marriage.,J,1,-1.1025391,1.2008144886751297,True
mistralai/Mixtral-8x7B-v0.1,Some people think courtship is the first in a series of steps leading to romance.,Some people still believe in romantic courtship.,S,1,-1.0878906,1.1665619317426117,False
mistralai/Mixtral-8x7B-v0.1,Some people's only culture is bacteria.,Everybody can appreciate the fine arts.,J,1,-0.80029297,1.1208870027605609,True
mistralai/Mixtral-8x7B-v0.1,Some people's only culture is radio.,Everyone watches television.,S,1,-1.1240234,1.2272094534628477,False
mistralai/Mixtral-8x7B-v0.1,"Statistics indicate that Americans spend eighty million a year on games of chance, mostly blackjack.",Americans like to gamble on card games.,S,1,-1.1660156,1.0623031898286097,False
mistralai/Mixtral-8x7B-v0.1,"Statistics indicate that Americans spend eighty million a year on games of chance, mostly weddings.",Getting married is a risky thing to do.,J,1,-1.0976562,1.1325029646425002,True
mistralai/Mixtral-8x7B-v0.1,Sunday is the day we bow our heads and putt.,We go to church on Sunday.,J,1,-0.79541016,0.9236548512839887,True
mistralai/Mixtral-8x7B-v0.1,Sunday is the day we bow our heads and rest.,We work hard on Sunday.,S,1,-0.80371094,0.996205147501846,False
mistralai/Mixtral-8x7B-v0.1,The accident injured his spinal cord and his legs are paralyzed.,He can move his legs.,E,1,-1.0908203,1.2580556151701403,False
mistralai/Mixtral-8x7B-v0.1,The art museum just acquired an early Rembrandt; it's done in charcoal.,This early work is an oil painting.,S,1,-1.1826172,1.2907387022431185,False
mistralai/Mixtral-8x7B-v0.1,The art museum just acquired an early Rembrandt; it's done in Crayola.,Rembrandt was a child when he completed the work.,J,1,-1.0820312,1.2132291364560694,True
mistralai/Mixtral-8x7B-v0.1,The baby cried and upset her mother.,The mother was very calm.,E,1,-0.96777344,1.180124212860984,False
mistralai/Mixtral-8x7B-v0.1,The bartender dropped two olives into the strong martini.,The bartender was preparing a drink.,E,1,-1.1894531,1.3103911378515747,False
mistralai/Mixtral-8x7B-v0.1,The best bargain I ever got was when I went to a family garage sale and bought a grandma.,I bought a car at the garage sale.,J,1,-0.90185547,1.0833690910098057,True
mistralai/Mixtral-8x7B-v0.1,The best bargain I ever got was when I went to a family garage sale and bought a toaster.,I got a really good deal on a blender.,S,1,-1.0527344,1.1840542582014317,False
mistralai/Mixtral-8x7B-v0.1,The best gift for the man who has everything is neckties.,A necktie always makes a good gift for a man.,S,1,-0.9970703,1.180196678049936,False
mistralai/Mixtral-8x7B-v0.1,The best gift for the man who has everything is penicillin.,This man has lots of diseases.,J,1,-0.859375,1.092024342800098,True
mistralai/Mixtral-8x7B-v0.1,The best way to keep the milk from turning sour is to keep it in the cold.,Milk turns sour faster when it's warm.,S,1,-0.984375,1.1190740032814221,False
mistralai/Mixtral-8x7B-v0.1,The best way to keep the milk from turning sour is to keep it in the cow.,Milk stays fresh for a long time.,J,1,-0.7963867,0.924252505573752,True
mistralai/Mixtral-8x7B-v0.1,The best way to remove coffee stains from a white blouse is with detergent.,Coffee stains are impossible to wash out.,S,1,-0.9916992,1.1990833298145407,False
mistralai/Mixtral-8x7B-v0.1,The best way to remove coffee stains from a white blouse is with scissors.,Coffee stains are easy to wash out.,J,1,-0.9116211,1.0763244592782328,True
mistralai/Mixtral-8x7B-v0.1,The best way to stop an elephant from charging is to cut off its credit.,Elephants should pay in cash.,J,1,-0.81933594,1.0115412558939763,True
mistralai/Mixtral-8x7B-v0.1,The best way to stop an elephant from charging is to cut off its toes.,Elephants can run quickly even without toes.,S,1,-0.9086914,1.0208018814692912,False
mistralai/Mixtral-8x7B-v0.1,The bill was due at the end of the month.,He had to pay by the thirty-first.,E,1,-1.1962891,1.3275310203719795,False
mistralai/Mixtral-8x7B-v0.1,The book that tells you where you can go on vacation is called a checkbook.,Where you go on vacation depends on how much you can afford.,J,1,-0.87402344,0.9176038004489004,True
mistralai/Mixtral-8x7B-v0.1,The book that tells you where you can go on vacation is called a guidebook.,Guidebooks aren't very useful for planning a trip.,S,1,-1.1279297,1.1446664996861238,False
mistralai/Mixtral-8x7B-v0.1,The children held their hands and formed a circle.,The children were watching television.,E,1,-1.1640625,1.2660115737970952,False
mistralai/Mixtral-8x7B-v0.1,The choir sang hymns while the people listened.,The people joined in the singing.,E,1,-1.0117188,1.139077096130551,False
mistralai/Mixtral-8x7B-v0.1,"The convict told his cellmate how he'd blown all the money he stole on wine, women, and crack.",The convict had been a drug user.,S,1,-1.0546875,1.2442236894769563,False
mistralai/Mixtral-8x7B-v0.1,"The convict told his cellmate how he'd blown all the money he stole on wine, women, and lawyers.",Lawyers are expensive.,J,1,-1.0957031,1.247783263154138,True
mistralai/Mixtral-8x7B-v0.1,"The cops claimed that the prisoner just decided to come clean, but most people think he was forced into the admission.",The prisoner may have been forced into confessing.,S,1,-1.0185547,1.1923118565571678,False
mistralai/Mixtral-8x7B-v0.1,"The cops claimed that the prisoner just decided to come clean, but most people think he was forced into the bathtub.",The prisoner had been dirty and needed to be washed.,J,1,-1.0664062,1.2587861138979366,True
mistralai/Mixtral-8x7B-v0.1,The curse of heavy drinking is that afterwards you get a huge bartab.,Drinking a lot can be expensive.,J,1,-1.0019531,1.1912130717093763,True
mistralai/Mixtral-8x7B-v0.1,The curse of heavy drinking is that afterwards you get a huge headache.,Drinking alcohol can lead to a hangover.,S,1,-1.2021484,1.2438493379712436,False
mistralai/Mixtral-8x7B-v0.1,The difference between a dog and a fox is about five beers.,Drinking makes women appear more attractive.,J,1,-1.3369141,1.3292410966231367,True
mistralai/Mixtral-8x7B-v0.1,The difference between a dog and a fox is about five degrees.,Dogs and foxes have the same body temperature.,S,1,-1.2607422,1.2406585511566401,False
mistralai/Mixtral-8x7B-v0.1,The difference between a good speaker and a bad one is often a nice diction.,It's important to speak clearly.,S,1,-0.95996094,1.0505774071482872,False
mistralai/Mixtral-8x7B-v0.1,The difference between a good speaker and a bad one is often a nice nap.,Bad speakers can put you to sleep.,J,1,-1.1972656,1.153722866327119,True
mistralai/Mixtral-8x7B-v0.1,The doctor said he could have a stroke because his arteries were getting narrow and clogged.,He was in excellent health.,E,1,-1.0625,1.2016083771082735,False
mistralai/Mixtral-8x7B-v0.1,The doctor told her not to scratch no matter how much it itched.,She had a heart condition.,E,1,-0.9902344,1.0739613791052214,False
mistralai/Mixtral-8x7B-v0.1,The farmer put a new engine in his old tractor.,The farmer wanted to keep the tractor.,E,1,-1.140625,1.262668826460765,False
mistralai/Mixtral-8x7B-v0.1,The first thing he does every morning is sit in the lotus position and meditate.,He starts every day with coffee and the morning news.,E,1,-1.0869141,1.2267707834197623,False
mistralai/Mixtral-8x7B-v0.1,The first two hundred story building opened in Chicago; it was a hotel.,Chicago has a skyscraper that's a hotel.,S,1,-1.0791016,1.2568620463545508,False
mistralai/Mixtral-8x7B-v0.1,The first two hundred story building opened in Chicago; it was a library.,This building had lots of books.,J,1,-1.1210938,1.2855835184876614,True
mistralai/Mixtral-8x7B-v0.1,The garment bag kept his suit from getting wrinkled.,His suit needed to be ironed.,E,1,-1.1650391,1.2675501105333922,False
mistralai/Mixtral-8x7B-v0.1,The husband who catches his wife in the act is probably on the snoop.,An unfaithful wife can get in trouble if her husband is on the lookout.,S,1,-1.0449219,1.2018664605366696,False
mistralai/Mixtral-8x7B-v0.1,The husband who catches his wife in the act is probably on the trapeze.,His wife is cheating on him.,J,1,-1.1171875,1.2136178428891056,True
mistralai/Mixtral-8x7B-v0.1,The last time a guy in a mask took all my money I was in shock.,I had been mugged.,S,1,-0.97265625,1.129708958741229,False
mistralai/Mixtral-8x7B-v0.1,The last time a guy in a mask took all my money I was in surgery.,I had been mugged.,J,1,-1.1884766,1.2233571601878535,True
mistralai/Mixtral-8x7B-v0.1,The lawyer feared that his client was guilty.,The lawyer was a prosecutor.,E,1,-1.1230469,1.2456053031751217,False
mistralai/Mixtral-8x7B-v0.1,The luggage handler seemed to take great delight in tossing the boxes marked fragile.,The luggage handler was very careful.,E,1,-1.1035156,1.1810696864780432,False
mistralai/Mixtral-8x7B-v0.1,The mole lived in a hole in the ground.,The mole was kept in the house as a pet.,E,1,-1.1113281,1.2944519713999445,False
mistralai/Mixtral-8x7B-v0.1,The most popular instrument in a Scottish marching band is the bagpipe.,"In Scottish marching bands, people like bagpipes more than drums.",E,1,-1.1611328,1.226936041481289,False
mistralai/Mixtral-8x7B-v0.1,The most prevalent form of legalized gambling is betting.,Betting is not very common.,S,1,-1.1933594,1.180549345649051,False
mistralai/Mixtral-8x7B-v0.1,The most prevalent form of legalized gambling is elections.,People are gambling when they vote for someone.,J,1,-1.0341797,1.0937542837461607,True
mistralai/Mixtral-8x7B-v0.1,The movers put the sofa on the bare floor.,The house was fully carpeted.,E,1,-1.1220703,1.23672631229074,False
mistralai/Mixtral-8x7B-v0.1,"The new tax forms are more realistic-- where your wife signs, it says: accomplice.",Your wife doesn't need to sign your tax form.,J,1,-0.87890625,1.1103068519655441,True
